{
  "$schema": "https://json-schema.org/draft/2020-12/schema",
  "$id": "https://github.com/vassiliylakhonin/agenda-intelligence-md/schemas/v1/gulf-maritime-exposure-response.schema.json",
  "title": "GulfMaritimeExposureResponse",
  "description": "Structured response for maritime sanctions and chokepoint-disruption exposure triage. Evidence-sufficiency triage only; always requires human review. Not legal, sanctions, compliance, financial, investment, insurance, or trading advice.",
  "x-schema-version": "1",
  "type": "object",
  "additionalProperties": false,
  "required": [
    "triage_recommendation",
    "exposure_signal",
    "decision_readiness_score",
    "decision_readiness_label",
    "voyage",
    "exposure_facets",
    "supplied_sources",
    "minimum_sources_before_review",
    "evidence_gaps",
    "top_exposure_dimensions",
    "chokepoint_disruption_watch",
    "watch_next",
    "human_review_required",
    "not_advice_notice",
    "limitations"
  ],
  "properties": {
    "triage_recommendation": {
      "type": "string",
      "enum": [
        "insufficient_information",
        "escalate_before_fixture",
        "escalate_before_voyage",
        "not_decision_ready",
        "ready_for_human_review"
      ]
    },
    "exposure_signal": {
      "type": "string",
      "enum": [
        "low",
        "medium",
        "medium_high",
        "high",
        "unknown"
      ]
    },
    "decision_readiness_score": {
      "type": "integer",
      "minimum": 0,
      "maximum": 100
    },
    "decision_readiness_label": {
      "type": "string",
      "enum": [
        "insufficient_information",
        "not_decision_ready",
        "partial",
        "review_ready"
      ]
    },
    "vessel": {
      "type": "object"
    },
    "voyage": {
      "type": "object"
    },
    "cargo": {
      "type": "string"
    },
    "exposure_facets": {
      "type": "array",
      "items": {
        "type": "string"
      }
    },
    "supplied_sources": {
      "type": "array",
      "items": {
        "type": "string"
      }
    },
    "minimum_sources_before_review": {
      "type": "array",
      "items": {
        "type": "string"
      }
    },
    "evidence_gaps": {
      "type": "array",
      "items": {
        "type": "string"
      }
    },
    "top_exposure_dimensions": {
      "type": "array",
      "items": {
        "type": "string"
      }
    },
    "chokepoint_disruption_watch": {
      "type": "array",
      "items": {
        "type": "string"
      }
    },
    "watch_next": {
      "type": "array",
      "items": {
        "type": "string"
      }
    },
    "human_review_required": {
      "type": "boolean",
      "const": true
    },
    "not_advice_notice": {
      "type": "string"
    },
    "limitations": {
      "type": "array",
      "items": {
        "type": "string"
      }
    },
    "readiness_contract": {
      "$ref": "#/$defs/readiness_contract"
    },
    "source_record_review": {
      "type": "object",
      "additionalProperties": false,
      "required": [
        "policy_version",
        "scope",
        "source_content_verified",
        "freshness_verified",
        "usable_source_types",
        "issues",
        "next_action"
      ],
      "properties": {
        "policy_version": {
          "const": "source-records.v1"
        },
        "scope": {
          "const": "reference_metadata_only"
        },
        "source_content_verified": {
          "const": false
        },
        "freshness_verified": {
          "const": false
        },
        "usable_source_types": {
          "type": "array",
          "items": {
            "type": "string"
          }
        },
        "issues": {
          "type": "array",
          "items": {
            "type": "object",
            "additionalProperties": false,
            "required": [
              "source_index",
              "source_type",
              "issue"
            ],
            "properties": {
              "source_index": {
                "type": "integer",
                "minimum": 0
              },
              "source_type": {
                "type": "string"
              },
              "issue": {
                "type": "string"
              }
            }
          }
        },
        "next_action": {
          "type": "string"
        }
      }
    },
    "next_action": {
      "type": "string",
      "enum": [
        "block",
        "review",
        "insufficient"
      ]
    },
    "decision_kind": {
      "const": "evidence_review"
    },
    "authorization_granted": {
      "const": false
    },
    "score_kind": {
      "type": "string",
      "enum": [
        "risk",
        "evidence_readiness",
        "not_scored"
      ]
    },
    "remediation": {
      "description": "Diagnostic metadata only. Does not alter score, verdict, admission, payment or authority.",
      "type": "object",
      "additionalProperties": false,
      "required": [
        "contract_version",
        "profile",
        "status",
        "issues",
        "issues_truncated",
        "evaluation_unchanged",
        "authorization_granted",
        "retry_unchanged_evidence",
        "human_review_required",
        "notice"
      ],
      "properties": {
        "contract_version": {
          "const": "worker-remediation.v1"
        },
        "profile": {
          "type": "string"
        },
        "status": {
          "enum": [
            "invalid_input",
            "technical_error",
            "needs_input",
            "service_limited",
            "ready_for_human_review",
            "input_valid"
          ]
        },
        "issues": {
          "type": "array",
          "maxItems": 64,
          "items": {
            "type": "object",
            "additionalProperties": false,
            "required": [
              "code",
              "category",
              "field",
              "machine_key",
              "result_field",
              "problem",
              "allowed_values",
              "basis",
              "repair",
              "recheck"
            ],
            "properties": {
              "code": {
                "type": "string"
              },
              "category": {
                "enum": [
                  "missing_data",
                  "rejected_data",
                  "service_limitation",
                  "technical_error"
                ]
              },
              "field": {
                "type": [
                  "string",
                  "null"
                ]
              },
              "machine_key": {
                "type": [
                  "string",
                  "null"
                ]
              },
              "result_field": {
                "type": [
                  "string",
                  "null"
                ]
              },
              "problem": {
                "type": "string"
              },
              "allowed_values": {
                "type": "array",
                "items": {
                  "type": "string"
                }
              },
              "basis": {
                "type": "object",
                "additionalProperties": false,
                "required": [
                  "kind",
                  "authority",
                  "rule_id",
                  "notice"
                ],
                "properties": {
                  "kind": {
                    "enum": [
                      "protocol_requirement",
                      "service_rule",
                      "legal_requirement"
                    ]
                  },
                  "authority": {
                    "type": "string"
                  },
                  "rule_id": {
                    "type": "string"
                  },
                  "notice": {
                    "type": "string"
                  }
                }
              },
              "repair": {
                "type": "object",
                "additionalProperties": false,
                "required": [
                  "action",
                  "example",
                  "example_is_evidence",
                  "template_requires_completion",
                  "instructions"
                ],
                "properties": {
                  "action": {
                    "type": "string"
                  },
                  "example": {},
                  "example_is_evidence": {
                    "const": false
                  },
                  "template_requires_completion": {
                    "type": "boolean"
                  },
                  "instructions": {
                    "type": "string"
                  }
                }
              },
              "recheck": {
                "type": "object",
                "additionalProperties": false,
                "required": [
                  "automatic_check_available",
                  "operation",
                  "requires_changed_evidence_or_authoritative_state",
                  "human_check"
                ],
                "properties": {
                  "automatic_check_available": {
                    "type": "boolean"
                  },
                  "operation": {
                    "type": [
                      "string",
                      "null"
                    ]
                  },
                  "requires_changed_evidence_or_authoritative_state": {
                    "const": true
                  },
                  "human_check": {
                    "type": "string"
                  }
                }
              }
            }
          }
        },
        "issues_truncated": {
          "type": "boolean"
        },
        "evaluation_unchanged": {
          "const": true
        },
        "authorization_granted": {
          "const": false
        },
        "retry_unchanged_evidence": {
          "const": false
        },
        "human_review_required": {
          "const": true
        },
        "notice": {
          "type": "string"
        }
      }
    },
    "voyage_gate": {
      "type": "object",
      "additionalProperties": false,
      "required": [
        "verdict",
        "readiness_level",
        "blocking_reasons",
        "ais_quality",
        "notice"
      ],
      "properties": {
        "verdict": {
          "enum": [
            "BLOCK_PRE_FIXTURE",
            "EVIDENCE_BLOCKED",
            "HUMAN_REVIEW_REQUIRED"
          ]
        },
        "readiness_level": {
          "enum": [
            "screening_only",
            "internal_review",
            "pre_fixture_committee",
            "human_review_candidate"
          ]
        },
        "blocking_reasons": {
          "type": "array",
          "items": {
            "type": "string",
            "enum": [
              "P_AND_I_UNKNOWN",
              "OWNERSHIP_OPAQUE",
              "STS_WITHOUT_HISTORY",
              "SANCTIONS_SCREEN_MISSING",
              "AIS_ONLY_FILE",
              "VESSEL_IDENTITY_MISSING",
              "REQUIRED_SOURCE_MISSING",
              "UPSTREAM_SCREEN_UNAVAILABLE",
              "UPSTREAM_SCREEN_MATCH"
            ]
          }
        },
        "ais_quality": {
          "const": "not_assessed"
        },
        "notice": {
          "type": "string"
        }
      }
    }
  },
  "$defs": {
    "readiness_named_value": {
      "type": "object",
      "additionalProperties": false,
      "required": [
        "field",
        "value"
      ],
      "properties": {
        "field": {
          "type": "string",
          "minLength": 1
        },
        "value": {
          "type": "string",
          "minLength": 1
        }
      }
    },
    "readiness_contract": {
      "type": "object",
      "additionalProperties": false,
      "description": "Additive normalized readiness view for cross-profile human-review routing. Built from existing response fields; does not replace profile-specific fields and does not imply approval, clearance, advice, factual verification, or autonomous decision-making.",
      "required": [
        "profile",
        "status",
        "score",
        "routing",
        "signal",
        "blocking_gaps",
        "non_blocking_gaps",
        "claim_audit",
        "owner_actions",
        "watch_next",
        "human_review_required",
        "boundary_notice"
      ],
      "properties": {
        "profile": {
          "type": "string",
          "minLength": 1
        },
        "status": {
          "type": "string",
          "minLength": 1
        },
        "score": {
          "type": [
            "integer",
            "null"
          ],
          "minimum": 0,
          "maximum": 100
        },
        "routing": {
          "anyOf": [
            {
              "$ref": "#/$defs/readiness_named_value"
            },
            {
              "type": "null"
            }
          ]
        },
        "signal": {
          "anyOf": [
            {
              "$ref": "#/$defs/readiness_named_value"
            },
            {
              "type": "null"
            }
          ]
        },
        "blocking_gaps": {
          "type": "array",
          "items": {}
        },
        "non_blocking_gaps": {
          "type": "array",
          "items": {}
        },
        "claim_audit": {
          "type": "array",
          "items": {}
        },
        "owner_actions": {
          "type": "array",
          "items": {}
        },
        "watch_next": {
          "type": "array",
          "items": {
            "type": "string",
            "minLength": 1
          }
        },
        "human_review_required": {
          "type": "boolean"
        },
        "boundary_notice": {
          "type": "string",
          "minLength": 1
        }
      }
    }
  }
}
