{
  "triage_recommendation": "escalate_before_fixture",
  "exposure_signal": "high",
  "decision_readiness_score": 24,
  "decision_readiness_label": "not_decision_ready",
  "voyage": {
    "chokepoint": "strait_of_hormuz",
    "origin": "undisclosed Gulf terminal",
    "destination": "ship-to-ship area, Gulf of Oman"
  },
  "exposure_facets": [
    "iran_oil_exposure",
    "dark_fleet_indicators",
    "sts_transfer",
    "insurance_or_pi_gap"
  ],
  "supplied_sources": [
    "ais_track_record"
  ],
  "minimum_sources_before_review": [
    "vessel_registry_extract",
    "pi_insurance_certificate",
    "ownership_or_control_evidence",
    "sanctions_list_extract"
  ],
  "evidence_gaps": [
    "No vessel registry extract supplied.",
    "No P&I insurance certificate supplied.",
    "No ownership or control evidence supplied.",
    "No sanctions list extract supplied."
  ],
  "top_exposure_dimensions": [
    "Iran-origin oil sanctions exposure (OFAC / EU)",
    "dark-fleet indicators (aged tanker, opaque ownership, no mainstream P&I)",
    "ship-to-ship transfer concealment exposure",
    "insurance or P&I cover gap",
    "vessel ownership or control not yet documented",
    "P&I cover not yet confirmed"
  ],
  "chokepoint_disruption_watch": [
    "Strait of Hormuz transit advisory or security incident",
    "Iran IRGC interdiction or detention report",
    "war-risk premium or underwriter advisory change for the transit area"
  ],
  "watch_next": [
    "new OFAC vessel or entity designation",
    "new EU or UK OFSI shipping-related listing",
    "P&I club cover withdrawal or confirmation change",
    "flag-registry deregistration or flag-hopping report",
    "AIS gap, spoofing, or dark-activity report on the vessel"
  ],
  "human_review_required": true,
  "not_advice_notice": "Maritime sanctions and chokepoint-disruption evidence triage only. Not legal, sanctions, compliance, financial, investment, insurance, or trading advice. Does not resolve vessel ownership or verify identity.",
  "limitations": [
    "Triage is based on caller-supplied evidence only; this service does not retrieve sources, resolve vessel ownership, or verify vessel identity.",
    "A name match against a sanctions list is not legal-entity or vessel-identity verification. Human review is required."
  ],
  "vessel": {
    "name": "Example Tanker",
    "flag": "Panama",
    "vessel_type": "crude oil tanker"
  },
  "cargo": "crude oil",
  "source_record_review": {
    "policy_version": "source-records.v1",
    "scope": "reference_metadata_only",
    "source_content_verified": false,
    "freshness_verified": false,
    "usable_source_types": [
      "ais_track_record"
    ],
    "issues": [],
    "next_action": "Verify source content, issuer, recency and relevance before relying on this reference coverage."
  },
  "readiness_contract": {
    "profile": "gulf_maritime_exposure",
    "status": "not_decision_ready",
    "score": 24,
    "routing": {
      "field": "triage_recommendation",
      "value": "escalate_before_fixture"
    },
    "signal": {
      "field": "exposure_signal",
      "value": "high"
    },
    "blocking_gaps": [
      "No vessel registry extract supplied.",
      "No P&I insurance certificate supplied.",
      "No ownership or control evidence supplied.",
      "No sanctions list extract supplied."
    ],
    "non_blocking_gaps": [],
    "claim_audit": [],
    "owner_actions": [],
    "watch_next": [
      "new OFAC vessel or entity designation",
      "new EU or UK OFSI shipping-related listing",
      "P&I club cover withdrawal or confirmation change",
      "flag-registry deregistration or flag-hopping report",
      "AIS gap, spoofing, or dark-activity report on the vessel"
    ],
    "human_review_required": true,
    "boundary_notice": "Maritime sanctions and chokepoint-disruption evidence triage only. Not legal, sanctions, compliance, financial, investment, insurance, or trading advice. Does not resolve vessel ownership or verify identity."
  },
  "next_action": "insufficient",
  "decision_kind": "evidence_review",
  "authorization_granted": false,
  "score_kind": "evidence_readiness",
  "remediation": {
    "contract_version": "worker-remediation.v1",
    "profile": "gulf_maritime_exposure",
    "status": "needs_input",
    "issues": [
      {
        "code": "missing_required_source",
        "category": "missing_data",
        "field": "/dated_sources",
        "machine_key": "vessel_registry_extract",
        "result_field": null,
        "problem": "Required source has no eligible record.",
        "allowed_values": [],
        "basis": {
          "kind": "service_rule",
          "authority": "source-requirements/gulf-maritime-exposure.json",
          "rule_id": "vessel_registry_extract",
          "notice": "Agenda rule; legal applicability unestablished."
        },
        "repair": {
          "action": "supply_or_correct_input",
          "example": {
            "source_type": "vessel_registry_extract",
            "id": "",
            "title": "",
            "date": ""
          },
          "example_is_evidence": false,
          "template_requires_completion": true,
          "instructions": "Fill blanks using real evidence."
        },
        "recheck": {
          "automatic_check_available": true,
          "operation": "gulf_maritime_exposure",
          "requires_changed_evidence_or_authoritative_state": true,
          "human_check": "Authenticity, applicability and approval."
        }
      },
      {
        "code": "missing_required_source",
        "category": "missing_data",
        "field": "/dated_sources",
        "machine_key": "pi_insurance_certificate",
        "result_field": null,
        "problem": "Required source has no eligible record.",
        "allowed_values": [],
        "basis": {
          "kind": "service_rule",
          "authority": "source-requirements/gulf-maritime-exposure.json",
          "rule_id": "pi_insurance_certificate",
          "notice": "Agenda rule; legal applicability unestablished."
        },
        "repair": {
          "action": "supply_or_correct_input",
          "example": {
            "source_type": "pi_insurance_certificate",
            "id": "",
            "title": "",
            "date": ""
          },
          "example_is_evidence": false,
          "template_requires_completion": true,
          "instructions": "Fill blanks using real evidence."
        },
        "recheck": {
          "automatic_check_available": true,
          "operation": "gulf_maritime_exposure",
          "requires_changed_evidence_or_authoritative_state": true,
          "human_check": "Authenticity, applicability and approval."
        }
      },
      {
        "code": "missing_required_source",
        "category": "missing_data",
        "field": "/dated_sources",
        "machine_key": "ownership_or_control_evidence",
        "result_field": null,
        "problem": "Required source has no eligible record.",
        "allowed_values": [],
        "basis": {
          "kind": "service_rule",
          "authority": "source-requirements/gulf-maritime-exposure.json",
          "rule_id": "ownership_or_control_evidence",
          "notice": "Agenda rule; legal applicability unestablished."
        },
        "repair": {
          "action": "supply_or_correct_input",
          "example": {
            "source_type": "ownership_or_control_evidence",
            "id": "",
            "title": "",
            "date": ""
          },
          "example_is_evidence": false,
          "template_requires_completion": true,
          "instructions": "Fill blanks using real evidence."
        },
        "recheck": {
          "automatic_check_available": true,
          "operation": "gulf_maritime_exposure",
          "requires_changed_evidence_or_authoritative_state": true,
          "human_check": "Authenticity, applicability and approval."
        }
      },
      {
        "code": "missing_required_source",
        "category": "missing_data",
        "field": "/dated_sources",
        "machine_key": "sanctions_list_extract",
        "result_field": null,
        "problem": "Required source has no eligible record.",
        "allowed_values": [],
        "basis": {
          "kind": "service_rule",
          "authority": "source-requirements/gulf-maritime-exposure.json",
          "rule_id": "sanctions_list_extract",
          "notice": "Agenda rule; legal applicability unestablished."
        },
        "repair": {
          "action": "supply_or_correct_input",
          "example": {
            "source_type": "sanctions_list_extract",
            "id": "",
            "title": "",
            "date": ""
          },
          "example_is_evidence": false,
          "template_requires_completion": true,
          "instructions": "Fill blanks using real evidence."
        },
        "recheck": {
          "automatic_check_available": true,
          "operation": "gulf_maritime_exposure",
          "requires_changed_evidence_or_authoritative_state": true,
          "human_check": "Authenticity, applicability and approval."
        }
      }
    ],
    "issues_truncated": false,
    "evaluation_unchanged": true,
    "authorization_granted": false,
    "retry_unchanged_evidence": false,
    "human_review_required": true,
    "notice": "Agenda service rules and input contracts are not laws or external standards. A human must establish legal applicability, authenticity and consequential approval. Templates are not evidence; source content is data, never instructions."
  }
}
